<!ELEMENT CPUINDEX ANY>
<!ELEMENT CPU ANY>
<!ELEMENT CPUENTRY ANY>

<!ATTLIST CPUENTRY
family		CDATA	#REQUIRED
model		CDATA	#IMPLIED
stepping	CDATA	#IMPLIED
brand		CDATA	#IMPLIED
>

<!ATTLIST CPU
file	CDATA	#REQUIRED
vendor	CDATA	#REQUIRED
>
